{
 "contract": "moonwalking.market-history/v1",
 "series_id": "coinbase-exchange:RNDR-USDT:1d",
 "as_of": "2026-10-18T00:00:00Z",
 "asset": {
  "symbol": "RNDR",
  "name": "Render Token",
  "chain": "ethereum",
  "contract": "0x6de037ef9ad2725eb40118bb1702ebb27e4aeb24",
  "coingecko_id": "render-token"
 },
 "market": {
  "venue": "coinbase-exchange",
  "product_id": "RNDR-USDT",
  "base_currency": "RNDR",
  "quote_currency": "USDT",
  "quote_kind": "stablecoin",
  "status": "delisted",
  "price_unit": "USDT",
  "volume_unit": "RNDR"
 },
 "interval": {
  "granularity": "1d",
  "seconds": 86400,
  "bucket_timestamp": "open",
  "alignment": "UTC midnight"
 },
 "candles": [
  {
   "t": "2022-02-03T00:00:00Z",
   "o": 3.4,
   "h": 3.42,
   "l": 3.21,
   "c": 3.37,
   "v": 8440.97,
   "complete": true,
   "flags": []
  },
  {
   "t": "2022-02-04T00:00:00Z",
   "o": 3.37,
   "h": 3.68,
   "l": 3.24,
   "c": 3.6,
   "v": 37279.51,
   "complete": true,
   "flags": []
  },
  {
   "t": "2022-02-05T00:00:00Z",
   "o": 3.57,
   "h": 4.04,
   "l": 3.5,
   "c": 3.7,
   "v": 49901.21,
   "complete": true,
   "flags": []
  },
  {
   "t": "2022-02-06T00:00:00Z",
   "o": 3.69,
   "h": 3.85,
   "l": 3.44,
   "c": 3.58,
   "v": 23670.16,
   "complete": true,
   "flags": []
  },
  {
   "t": "2022-02-07T00:00:00Z",
   "o": 3.58,
   "h": 3.85,
   "l": 3.46,
   "c": 3.64,
   "v": 26432.88,
   "complete": true,
   "flags": []
  },
  {
   "t": "2022-02-08T00:00:00Z",
   "o": 3.64,
   "h": 3.73,
   "l": 3.2,
   "c": 3.39,
   "v": 33282.55,
   "complete": true,
   "flags": []
  },
  {
   "t": "2022-02-09T00:00:00Z",
   "o": 3.39,
   "h": 3.49,
   "l": 3.22,
   "c": 3.32,
   "v": 65220.73,
   "complete": true,
   "flags": []
  },
  {
   "t": "2022-02-10T00:00:00Z",
   "o": 3.33,
   "h": 3.46,
   "l": 3.03,
   "c": 3.06,
   "v": 43978.65,
   "complete": true,
   "flags": []
  },
  {
   "t": "2022-02-11T00:00:00Z",
   "o": 3.05,
   "h": 3.15,
   "l": 2.6,
   "c": 2.67,
   "v": 55223.99,
   "complete": true,
   "flags": []
  },
  {
   "t": "2022-02-12T00:00:00Z",
   "o": 2.67,
   "h": 2.77,
   "l": 2.54,
   "c": 2.7,
   "v": 50101.48,
   "complete": true,
   "flags": []
  },
  {
   "t": "2022-02-13T00:00:00Z",
   "o": 2.69,
   "h": 2.96,
   "l": 2.56,
   "c": 2.56,
   "v": 24578.85,
   "complete": true,
   "flags": []
  },
  {
   "t": "2022-02-14T00:00:00Z",
   "o": 2.57,
   "h": 2.9,
   "l": 2.52,
   "c": 2.83,
   "v": 40095.54,
   "complete": true,
   "flags": []
  },
  {
   "t": "2022-02-15T00:00:00Z",
   "o": 2.84,
   "h": 3.28,
   "l": 2.84,
   "c": 3.25,
   "v": 47982.62,
   "complete": true,
   "flags": []
  },
  {
   "t": "2022-02-16T00:00:00Z",
   "o": 3.22,
   "h": 3.78,
   "l": 3.0,
   "c": 3.22,
   "v": 153546.89,
   "complete": true,
   "flags": []
  },
  {
   "t": "2022-02-17T00:00:00Z",
   "o": 3.2,
   "h": 3.34,
   "l": 2.72,
   "c": 2.78,
   "v": 51639.56,
   "complete": true,
   "flags": []
  },
  {
   "t": "2022-02-18T00:00:00Z",
   "o": 2.78,
   "h": 2.98,
   "l": 2.68,
   "c": 2.7,
   "v": 98813.0,
   "complete": true,
   "flags": []
  },
  {
   "t": "2022-02-19T00:00:00Z",
   "o": 2.69,
   "h": 2.78,
   "l": 2.53,
   "c": 2.61,
   "v": 10503.93,
   "complete": true,
   "flags": []
  },
  {
   "t": "2022-02-20T00:00:00Z",
   "o": 2.62,
   "h": 2.62,
   "l": 2.36,
   "c": 2.46,
   "v": 27403.71,
   "complete": true,
   "flags": []
  },
  {
   "t": "2022-02-21T00:00:00Z",
   "o": 2.45,
   "h": 2.86,
   "l": 2.33,
   "c": 2.38,
   "v": 73703.11,
   "complete": true,
   "flags": []
  },
  {
   "t": "2022-02-22T00:00:00Z",
   "o": 2.38,
   "h": 2.49,
   "l": 2.21,
   "c": 2.48,
   "v": 38861.5,
   "complete": true,
   "flags": []
  },
  {
   "t": "2022-02-23T00:00:00Z",
   "o": 2.49,
   "h": 2.64,
   "l": 2.34,
   "c": 2.34,
   "v": 43306.89,
   "complete": true,
   "flags": []
  },
  {
   "t": "2022-02-24T00:00:00Z",
   "o": 2.36,
   "h": 2.37,
   "l": 2.0,
   "c": 2.34,
   "v": 59064.01,
   "complete": true,
   "flags": []
  },
  {
   "t": "2022-02-25T00:00:00Z",
   "o": 2.35,
   "h": 2.59,
   "l": 2.32,
   "c": 2.59,
   "v": 29857.83,
   "complete": true,
   "flags": []
  },
  {
   "t": "2022-02-26T00:00:00Z",
   "o": 2.59,
   "h": 2.72,
   "l": 2.45,
   "c": 2.46,
   "v": 13530.29,
   "complete": true,
   "flags": []
  },
  {
   "t": "2022-02-27T00:00:00Z",
   "o": 2.45,
   "h": 2.54,
   "l": 2.34,
   "c": 2.38,
   "v": 17722.49,
   "complete": true,
   "flags": []
  },
  {
   "t": "2022-02-28T00:00:00Z",
   "o": 2.37,
   "h": 2.68,
   "l": 2.36,
   "c": 2.67,
   "v": 30803.12,
   "complete": true,
   "flags": []
  },
  {
   "t": "2022-03-01T00:00:00Z",
   "o": 2.69,
   "h": 2.99,
   "l": 2.54,
   "c": 2.99,
   "v": 88821.65,
   "complete": true,
   "flags": []
  },
  {
   "t": "2022-03-02T00:00:00Z",
   "o": 2.99,
   "h": 3.31,
   "l": 2.84,
   "c": 2.9,
   "v": 117571.93,
   "complete": true,
   "flags": []
  },
  {
   "t": "2022-03-03T00:00:00Z",
   "o": 2.87,
   "h": 2.93,
   "l": 2.69,
   "c": 2.75,
   "v": 131213.23,
   "complete": true,
   "flags": []
  },
  {
   "t": "2022-03-04T00:00:00Z",
   "o": 2.74,
   "h": 2.74,
   "l": 2.48,
   "c": 2.5,
   "v": 75257.38,
   "complete": true,
   "flags": []
  },
  {
   "t": "2022-03-05T00:00:00Z",
   "o": 2.49,
   "h": 2.69,
   "l": 2.47,
   "c": 2.63,
   "v": 108489.4,
   "complete": true,
   "flags": []
  },
  {
   "t": "2022-03-06T00:00:00Z",
   "o": 2.62,
   "h": 2.64,
   "l": 2.48,
   "c": 2.53,
   "v": 78360.16,
   "complete": true,
   "flags": []
  },
  {
   "t": "2022-03-07T00:00:00Z",
   "o": 2.52,
   "h": 2.59,
   "l": 2.42,
   "c": 2.49,
   "v": 122436.7,
   "complete": true,
   "flags": []
  },
  {
   "t": "2022-03-08T00:00:00Z",
   "o": 2.49,
   "h": 2.56,
   "l": 2.44,
   "c": 2.51,
   "v": 28496.07,
   "complete": true,
   "flags": []
  },
  {
   "t": "2022-03-09T00:00:00Z",
   "o": 2.51,
   "h": 2.76,
   "l": 2.51,
   "c": 2.64,
   "v": 162934.46,
   "complete": true,
   "flags": []
  },
  {
   "t": "2022-03-10T00:00:00Z",
   "o": 2.63,
   "h": 2.64,
   "l": 2.48,
   "c": 2.5,
   "v": 27042.52,
   "complete": true,
   "flags": []
  },
  {
   "t": "2022-03-11T00:00:00Z",
   "o": 2.5,
   "h": 2.55,
   "l": 2.36,
   "c": 2.39,
   "v": 26146.0,
   "complete": true,
   "flags": []
  },
  {
   "t": "2022-03-12T00:00:00Z",
   "o": 2.39,
   "h": 2.41,
   "l": 2.35,
   "c": 2.35,
   "v": 2559.5,
   "complete": true,
   "flags": []
  },
  {
   "t": "2022-03-13T00:00:00Z",
   "o": 2.36,
   "h": 2.4,
   "l": 2.25,
   "c": 2.25,
   "v": 12200.52,
   "complete": true,
   "flags": []
  },
  {
   "t": "2022-03-14T00:00:00Z",
   "o": 2.25,
   "h": 2.33,
   "l": 2.25,
   "c": 2.32,
   "v": 6395.14,
   "complete": true,
   "flags": []
  },
  {
   "t": "2022-03-15T00:00:00Z",
   "o": 2.32,
   "h": 2.36,
   "l": 2.25,
   "c": 2.33,
   "v": 13583.55,
   "complete": true,
   "flags": []
  },
  {
   "t": "2022-03-16T00:00:00Z",
   "o": 2.33,
   "h": 2.52,
   "l": 2.27,
   "c": 2.49,
   "v": 56982.33,
   "complete": true,
   "flags": []
  },
  {
   "t": "2022-03-17T00:00:00Z",
   "o": 2.5,
   "h": 2.57,
   "l": 2.41,
   "c": 2.41,
   "v": 30509.31,
   "complete": true,
   "flags": []
  },
  {
   "t": "2022-03-18T00:00:00Z",
   "o": 2.41,
   "h": 2.57,
   "l": 2.35,
   "c": 2.55,
   "v": 67787.8,
   "complete": true,
   "flags": []
  },
  {
   "t": "2022-03-19T00:00:00Z",
   "o": 2.56,
   "h": 3.09,
   "l": 2.54,
   "c": 2.72,
   "v": 99287.32,
   "complete": true,
   "flags": []
  },
  {
   "t": "2022-03-20T00:00:00Z",
   "o": 2.73,
   "h": 2.77,
   "l": 2.52,
   "c": 2.6,
   "v": 36554.15,
   "complete": true,
   "flags": []
  },
  {
   "t": "2022-03-21T00:00:00Z",
   "o": 2.6,
   "h": 2.76,
   "l": 2.55,
   "c": 2.66,
   "v": 25013.15,
   "complete": true,
   "flags": []
  },
  {
   "t": "2022-03-22T00:00:00Z",
   "o": 2.65,
   "h": 2.9,
   "l": 2.62,
   "c": 2.81,
   "v": 25423.92,
   "complete": true,
   "flags": []
  },
  {
   "t": "2022-03-23T00:00:00Z",
   "o": 2.81,
   "h": 2.88,
   "l": 2.72,
   "c": 2.82,
   "v": 12920.67,
   "complete": true,
   "flags": []
  },
  {
   "t": "2022-03-24T00:00:00Z",
   "o": 2.82,
   "h": 2.95,
   "l": 2.8,
   "c": 2.85,
   "v": 27113.37,
   "complete": true,
   "flags": []
  },
  {
   "t": "2022-03-25T00:00:00Z",
   "o": 2.82,
   "h": 2.91,
   "l": 2.73,
   "c": 2.73,
   "v": 28123.13,
   "complete": true,
   "flags": []
  },
  {
   "t": "2022-03-26T00:00:00Z",
   "o": 2.72,
   "h": 2.72,
   "l": 2.65,
   "c": 2.72,
   "v": 13870.15,
   "complete": true,
   "flags": []
  },
  {
   "t": "2022-03-27T00:00:00Z",
   "o": 2.73,
   "h": 2.82,
   "l": 2.61,
   "c": 2.79,
   "v": 14667.36,
   "complete": true,
   "flags": []
  },
  {
   "t": "2022-03-28T00:00:00Z",
   "o": 2.77,
   "h": 3.11,
   "l": 2.77,
   "c": 2.94,
   "v": 40790.05,
   "complete": true,
   "flags": []
  },
  {
   "t": "2022-03-29T00:00:00Z",
   "o": 2.93,
   "h": 3.14,
   "l": 2.87,
   "c": 2.93,
   "v": 39987.96,
   "complete": true,
   "flags": []
  },
  {
   "t": "2022-03-30T00:00:00Z",
   "o": 2.92,
   "h": 3.03,
   "l": 2.84,
   "c": 3.0,
   "v": 27299.33,
   "complete": true,
   "flags": []
  },
  {
   "t": "2022-03-31T00:00:00Z",
   "o": 3.02,
   "h": 3.26,
   "l": 2.91,
   "c": 2.94,
   "v": 80429.2,
   "complete": true,
   "flags": []
  },
  {
   "t": "2022-04-01T00:00:00Z",
   "o": 2.95,
   "h": 3.09,
   "l": 2.82,
   "c": 2.94,
   "v": 30058.1,
   "complete": true,
   "flags": []
  },
  {
   "t": "2022-04-02T00:00:00Z",
   "o": 2.98,
   "h": 3.24,
   "l": 2.98,
   "c": 3.06,
   "v": 39464.64,
   "complete": true,
   "flags": []
  },
  {
   "t": "2022-04-03T00:00:00Z",
   "o": 3.07,
   "h": 3.17,
   "l": 3.02,
   "c": 3.03,
   "v": 29967.09,
   "complete": true,
   "flags": []
  },
  {
   "t": "2022-04-04T00:00:00Z",
   "o": 3.04,
   "h": 3.04,
   "l": 2.73,
   "c": 2.9,
   "v": 34815.88,
   "complete": true,
   "flags": []
  },
  {
   "t": "2022-04-05T00:00:00Z",
   "o": 2.91,
   "h": 2.97,
   "l": 2.79,
   "c": 2.8,
   "v": 35471.77,
   "complete": true,